{
  "schema": "talonsoclab.soc-intake/v2",
  "generated": "2026-07-22T12:00:00Z",
  "source": "talonsoclab",
  "consumer": "casa-ai-agent (github.com/ktalons/casa-ai-agent)",
  "window": { "start": "2026-07-21T12:00:00Z", "end": "2026-07-22T12:00:00Z", "lookback_hours": 24 },
  "filter": { "min_level": 12, "cap": 200, "order": "newest_first" },
  "truncated": false,
  "pipeline": { "collector_ok": true, "agents_reporting": 3, "last_event_seen": "2026-07-22T11:57:40.210Z" },
  "detections": [
    {
      "level": 12,
      "description": "Periodic outbound HTTPS connections to a rarely-contacted external host (regular interval)",
      "rule_id": "100305",
      "agent": "talonmacbook",
      "mitre": ["T1071.001"],
      "timestamp": "2026-07-22T09:41:12.004Z",
      "alert_id": "1784799672.004001",
      "src_ip": "10.10.40.23",
      "dst_ip": "203.0.113.45",
      "user": null,
      "event_id": null,
      "tactic": ["command-and-control"],
      "groups": ["network", "beaconing"]
    },
    {
      "level": 12,
      "description": "DNS query for a newly-observed high-entropy domain",
      "rule_id": "100310",
      "agent": "talonmacbook",
      "mitre": ["T1071.004"],
      "timestamp": "2026-07-22T09:39:58.770Z",
      "alert_id": "1784799598.770002",
      "src_ip": "10.10.40.23",
      "dst_ip": null,
      "user": null,
      "event_id": null,
      "tactic": ["command-and-control"],
      "groups": ["network", "dns", "dga"]
    }
  ],
  "recon_delta": {
    "markdown": "## Recon delta — 2026-07-22\n\n- **NEW** `talonmacbook:8443/tcp` responding with a self-signed TLS cert — not present in the 2026-07-15 baseline.\n",
    "baseline": "2026-07-15",
    "changes": [ { "host": "talonmacbook", "port": 8443, "proto": "tcp", "status": "new" } ]
  },
  "note": "Deterministic intake. Reasoning happens in CASA, not here."
}
